{
  "schema_version": "devseek.golden-case-catalog/v1",
  "integrity": {
    "hash_algorithm": "sha256",
    "canonicalization_version": "devseek-canonical-json/v1",
    "signature_algorithm": "ed25519"
  },
  "integrity_scope": "local-protocol-conformance",
  "qualification_eligible": false,
  "source_status": "verified",
  "catalog_id": "DEVSEEK-G0B-PROTOCOL-CONFORMANCE",
  "catalog_version": 1,
  "case_id_policy": "case-id-plus-version-is-immutable",
  "cases": [
    {
      "schema_version": "devseek.golden-case/v1",
      "case_id": "G0B-P01",
      "case_version": 1,
      "case_sha256": "91de723b2dbb90c7262114c4eee82c2ad6d4e0186aaf2bae67a2c570ce322949",
      "integrity_scope": "local-protocol-conformance",
      "qualification_eligible": false,
      "implementation_state": "implemented-local-conformance",
      "category": "protocol",
      "title": "Canonical plan, slot, event, and receipt hashing is deterministic",
      "capability_ids": [
        "C0-PREREGISTRATION-PLAN"
      ],
      "stage_types": [
        "T0"
      ],
      "threat_model": "Different serializers or key ordering create divergent identities.",
      "stimulus": "Recompute every fixture hash with independent devseek-canonical-json/v1 implementations.",
      "expected_result": "All SHA-256 values agree byte-for-byte and unsupported JSON values fail closed.",
      "hard_veto_codes": [
        "canonical-hash-divergence"
      ],
      "fixture": {
        "fixture_id": "g0b-p01-canonical-hash",
        "integrity_scope": "local-protocol-conformance",
        "qualification_eligible": false,
        "input_sha256": "5642dc0e3e7c6aa66680f4ba98cd1b56da27126f31da45eb6a1b1152c7359484",
        "workspace_fixture_sha256": "7b5ea386c7a3c8f5c2780e9b87e4cbc006eb67a89ef42522919f3aa6c66770a3",
        "hidden_variant_id": "local-visible-v1"
      },
      "executor_ref": {
        "executor_id": "g0b-protocol-runner/v1",
        "source_ref": "scripts/test/devseek-qualification-protocol.test.mjs",
        "entrypoint": "canonical-hash-vectors",
        "contract_sha256": "d8b27af9d07ae1a40169cbff31b1a2b7f4988474f8d7b29d2f6359258a773a21",
        "source_content_sha256": "023430c8ecad13de66dcff35d6f97cd0894733946b13df7740e36622aea9bdcb"
      },
      "oracle_refs": [
        {
          "oracle_id": "g0b-independent-integrity-oracle/v1",
          "source_ref": "scripts/test/devseek-qualification-protocol.test.mjs",
          "entrypoint": "verify-canonical-hashes",
          "expected_decision": "allow",
          "independent_from_executor": true,
          "contract_sha256": "93122cdc428dd683eb5a7400fe62fde340b39025b74396b9cb555a928ed0afb4",
          "source_content_sha256": "023430c8ecad13de66dcff35d6f97cd0894733946b13df7740e36622aea9bdcb"
        }
      ]
    },
    {
      "schema_version": "devseek.golden-case/v1",
      "case_id": "G0B-A01",
      "case_version": 1,
      "case_sha256": "2bb24d71d8e086d631462fb4b26f9ff4aa4b48703f3439a824689631d151bce2",
      "integrity_scope": "local-protocol-conformance",
      "qualification_eligible": false,
      "implementation_state": "implemented-local-conformance",
      "category": "attack",
      "title": "Unsigned or mutated plan cannot authorize an external action",
      "capability_ids": [
        "C0-PREREGISTRATION-PLAN"
      ],
      "stage_types": [
        "T1"
      ],
      "threat_model": "A plan is added, removed, reordered, or changed after registration.",
      "stimulus": "Present an unsigned plan and a signed plan whose slot list changed after signing.",
      "expected_result": "The guard denies before browser, authentication, or network activity.",
      "hard_veto_codes": [
        "missing-plan-signature",
        "plan-hash-mismatch",
        "external-action-before-guard"
      ],
      "fixture": {
        "fixture_id": "g0b-a01-plan-mutation",
        "integrity_scope": "local-protocol-conformance",
        "qualification_eligible": false,
        "input_sha256": "f7919e1bb2265c7896d3ca9255d0bf56625de81e56a2e051c83858a00cdaa8db",
        "workspace_fixture_sha256": "6b62d931cbd161c8e7a4d3bdcca06778a20b6a07d032c8967ba4f9c20193dbae",
        "hidden_variant_id": "local-visible-v1"
      },
      "executor_ref": {
        "executor_id": "g0b-guard-attack-runner/v1",
        "source_ref": "scripts/test/devseek-qualification-protocol.test.mjs",
        "entrypoint": "reject-unsigned-or-mutated-plan",
        "contract_sha256": "f10e9e03dcb001344535373f7b7a19f08603b59e7e993f07b0824e625093899e",
        "source_content_sha256": "023430c8ecad13de66dcff35d6f97cd0894733946b13df7740e36622aea9bdcb"
      },
      "oracle_refs": [
        {
          "oracle_id": "g0b-side-effect-oracle/v1",
          "source_ref": "scripts/test/devseek-qualification-protocol.test.mjs",
          "entrypoint": "assert-zero-external-actions",
          "expected_decision": "deny",
          "independent_from_executor": true,
          "contract_sha256": "9851fa78ed83e949d4f9ab607a18f4ae95f25d8c5a6a8c0456f59a5c082224d4",
          "source_content_sha256": "023430c8ecad13de66dcff35d6f97cd0894733946b13df7740e36622aea9bdcb"
        }
      ]
    },
    {
      "schema_version": "devseek.golden-case/v1",
      "case_id": "G0B-A02",
      "case_version": 1,
      "case_sha256": "a28fb038001a174391d42defc135f79253e9a159eb029a12a2f7f7e021bc4874",
      "integrity_scope": "local-protocol-conformance",
      "qualification_eligible": false,
      "implementation_state": "implemented-local-conformance",
      "category": "attack",
      "title": "Local clock drift cannot extend a trusted plan window",
      "capability_ids": [
        "C0-PREREGISTRATION-PLAN"
      ],
      "stage_types": [
        "T1"
      ],
      "threat_model": "A runner changes its local clock to use an expired or not-yet-valid slot.",
      "stimulus": "Move runner time inside the window while trusted store time remains outside it.",
      "expected_result": "The attempt is invalid and no slot is consumed.",
      "hard_veto_codes": [
        "trusted-time-window-violation"
      ],
      "fixture": {
        "fixture_id": "g0b-a02-time-drift",
        "integrity_scope": "local-protocol-conformance",
        "qualification_eligible": false,
        "input_sha256": "1a1f57de88230e388abc44b0c0b13f0383e4b9d36a07e1e4611b822e91f4645c",
        "workspace_fixture_sha256": "f156192f3fc7f93b3a830e5002433586bd22ff3ae07efe0c0b54c9de66cce1da",
        "hidden_variant_id": "local-visible-v1"
      },
      "executor_ref": {
        "executor_id": "g0b-time-attack-runner/v1",
        "source_ref": "scripts/test/devseek-qualification-protocol.test.mjs",
        "entrypoint": "reject-runner-clock-drift",
        "contract_sha256": "ff55b9bac8bf83898ceca9dc253b3966f0a6f4792ac31e352ed76a3e1454b653",
        "source_content_sha256": "023430c8ecad13de66dcff35d6f97cd0894733946b13df7740e36622aea9bdcb"
      },
      "oracle_refs": [
        {
          "oracle_id": "g0b-trusted-time-oracle/v1",
          "source_ref": "scripts/test/devseek-qualification-protocol.test.mjs",
          "entrypoint": "classify-window",
          "expected_decision": "invalidate",
          "independent_from_executor": true,
          "contract_sha256": "612dd82f9b61986cb67de52251e9f7b59fac494ea5fe92fd13a6b05e2195e5f9",
          "source_content_sha256": "023430c8ecad13de66dcff35d6f97cd0894733946b13df7740e36622aea9bdcb"
        }
      ]
    },
    {
      "schema_version": "devseek.golden-case/v1",
      "case_id": "G0B-A03",
      "case_version": 1,
      "case_sha256": "97bc4788f3d13e035612fb5a74efaea69172a00dd4ce91672b15ef5feed9a037",
      "integrity_scope": "local-protocol-conformance",
      "qualification_eligible": false,
      "implementation_state": "implemented-local-conformance",
      "category": "attack",
      "title": "Receipt replay across sessions is rejected",
      "capability_ids": [
        "C0-PREREGISTRATION-PLAN"
      ],
      "stage_types": [
        "T1",
        "T2"
      ],
      "threat_model": "A valid one-time receipt is copied into another qualification session.",
      "stimulus": "Replay a receipt with a different qualification_session_id.",
      "expected_result": "The guard rejects the receipt and records a replay event.",
      "hard_veto_codes": [
        "cross-session-receipt-replay"
      ],
      "fixture": {
        "fixture_id": "g0b-a03-cross-session-replay",
        "integrity_scope": "local-protocol-conformance",
        "qualification_eligible": false,
        "input_sha256": "ae75289b56dee3b166fc80be0a20f10f562b4c9f334e8fcab94a324260f5daa2",
        "workspace_fixture_sha256": "c0a79a2430e7a173ec00004a13b9ec610e350cb823f58cb6d42a8998b9f4009f",
        "hidden_variant_id": "local-visible-v1"
      },
      "executor_ref": {
        "executor_id": "g0b-replay-attack-runner/v1",
        "source_ref": "scripts/test/devseek-qualification-protocol.test.mjs",
        "entrypoint": "reject-cross-session-receipt",
        "contract_sha256": "b7ec701d07d6ef6913675ffbb283c264c5444e8cc0eabe0ddc89b6c639d439c5",
        "source_content_sha256": "023430c8ecad13de66dcff35d6f97cd0894733946b13df7740e36622aea9bdcb"
      },
      "oracle_refs": [
        {
          "oracle_id": "g0b-receipt-binding-oracle/v1",
          "source_ref": "scripts/test/devseek-qualification-protocol.test.mjs",
          "entrypoint": "verify-session-binding",
          "expected_decision": "deny",
          "independent_from_executor": true,
          "contract_sha256": "d9545e60637d3b7ae31dc80c210b1bf302f36d0ec3c0af63dbf63a2e64cf5abc",
          "source_content_sha256": "023430c8ecad13de66dcff35d6f97cd0894733946b13df7740e36622aea9bdcb"
        }
      ]
    },
    {
      "schema_version": "devseek.golden-case/v1",
      "case_id": "G0B-A04",
      "case_version": 1,
      "case_sha256": "a4b708b0ea7230f5d5181c8c9bd04d61926fe0956d7d9461b2fa38a7f9b9cd52",
      "integrity_scope": "local-protocol-conformance",
      "qualification_eligible": false,